{
  "id": "rapamycin",
  "name": "Rapamycin (sirolimus) for healthy aging",
  "brand_names": ["Rapamune"],
  "aliases": ["sirolimus", "mTOR inhibitor"],
  "category": "investigational",
  "conditions": ["healthspan"],
  "tier": "U",
  "tier_rationale": "The definitive trial is running but has not reported. TRIAD is a properly randomized, placebo-controlled, multicentre trial with lifespan and healthspan endpoints, but as of mid-2026 it has enrolled roughly 180 of a target 580 dogs and only a few have completed the full three-year period. Published TRIAD output so far is baseline cohort description, not outcome data. Tier U means untested, not disproven — this is the most scientifically serious longevity effort in dogs, and it deserves patience rather than extrapolation.",
  "regulatory": {
    "us": "Not approved for any use in dogs. Human formulations are sometimes prescribed off-label, which is legal but places the evidentiary burden entirely on the prescribing veterinarian.",
    "notes": "Off-label prescribing outside a trial means accepting an unknown risk-benefit ratio in exchange for an unproven benefit."
  },
  "plain_summary": "The most credible candidate for a genuine anti-aging drug in dogs, currently being tested in a real randomized trial that has not yet reported results. There is no honest basis today for giving it to a healthy dog outside that trial.",
  "what_trials_show": "TRIAD — the Test of Rapamycin in Aging Dogs, run through the Dog Aging Project — is described by its investigators as the first rigorous test of a pharmacologic intervention against biological aging with lifespan and healthspan endpoints performed outside the laboratory in any species. Eligible normally aging dogs at least seven years old receive oral rapamycin or placebo for one year, followed by a two-year observation period. As of 2026, enrollment stands at over 180 dogs against a target of 580, with a handful having completed the full three years. The trial survived a funding crisis via a $7 million grant. The published TRIAD work to date covers cognitive assessment methodology and baseline cohort characteristics — for instance, 35 dogs examined for inclusion with a median age of 9.2 years and median weight of 27.7 kg — rather than any efficacy result. Anyone citing rapamycin as proven in dogs is citing mouse data or hope.",
  "harms": "Not characterized for long-term use in healthy dogs — which is precisely what the trial exists to determine. Rapamycin is an immunosuppressant at transplant doses; the geroscience hypothesis relies on intermittent low doses behaving differently, and that assumption is being tested, not established. Plausible concerns include impaired wound healing, metabolic effects, and infection susceptibility. A healthy dog given this off-label is absorbing unquantified risk for an unquantified benefit.",
  "practical": {
    "route": "Oral, intermittent dosing in the trial protocol",
    "typical_course": "TRIAD protocol: 1 year of dosing, 2 years of observation",
    "monitoring": "Within the trial, extensive. Outside it, no established monitoring protocol exists.",
    "cost_signal": "varies"
  },
  "ask_your_vet": [
    "Is my dog eligible for TRIAD, and is there an enrolling site near me?",
    "If you would prescribe this off-label, what monitoring plan and stopping rules would you use, given no protocol has been validated?",
    "What would we be giving up by waiting for the trial to report?"
  ],
  "evidence": [
    {
      "type": "ongoing_trial",
      "citation": "Dog Aging Project. Test of Rapamycin in Aging Dogs (TRIAD). Multicentre randomized placebo-controlled trial, ongoing.",
      "year": 2026,
      "n": 180,
      "design": "Randomized, placebo-controlled, multicentre",
      "blinding": "double-blind",
      "control": "Placebo",
      "duration": "1 year of treatment plus 2 years of observation",
      "population": "Healthy, middle-aged, medium-to-large companion dogs aged 7+, target enrollment 580",
      "primary_outcome": "Lifespan and healthspan",
      "result": "Enrollment ongoing; no efficacy results published as of mid-2026.",
      "funding": "National Institute on Aging and philanthropic support, including a $7 million rescue grant",
      "summary": "The trial that will actually answer this question. Until it reports, the honest answer about rapamycin in dogs is that nobody knows.",
      "url": "https://dogagingproject.org/triad"
    },
    {
      "type": "observational",
      "citation": "Canine cognition assessments in the Test of Rapamycin in Aging Dogs (TRIAD). 2024.",
      "year": 2024,
      "n": 35,
      "design": "Baseline cohort characterization",
      "blinding": "not-applicable",
      "population": "Dogs screened for TRIAD inclusion; median age 9.2 years, median weight 27.7 kg",
      "result": "Median CADES score 1.0, median Sustained Gaze score 9.0 at baseline.",
      "summary": "Methodological groundwork, explicitly not an efficacy result. Included so the distinction is visible rather than blurred.",
      "url": "https://www.ncbi.nlm.nih.gov/pmc/articles/PMC11692996/"
    },
    {
      "type": "regulatory",
      "citation": "$7M grant rescues dog study investigating rapamycin for canine aging. American Veterinary Medical Association, 2025.",
      "year": 2025,
      "design": "News report on trial funding",
      "blinding": "not-applicable",
      "result": "Funding secured to continue TRIAD after a shortfall threatened it.",
      "summary": "Context on why results are slower than the surrounding enthusiasm suggests.",
      "url": "https://www.avma.org/news/7m-grant-rescues-dog-study-investigating-rapamycin-canine-aging"
    }
  ],
  "see_also": ["loy-002"],
  "last_reviewed": "2026-08-04",
  "contributors": ["@lextechx"]
}
